{
  "$schema": "http://json-schema.org/draft-07/schema#",
  "title": "BubbleInput",
  "type": "object",
  "additionalProperties": false,
  "required": ["schema_version", "realm_id", "payload_id", "generated_at", "permissions", "revision"],
  "properties": {
    "schema_version": { "type": "string" },
    "realm_id": { "type": "string", "enum": ["today", "overview", "reflection"] },
    "payload_id": { "type": "string" },
    "generated_at": { "type": "string" },
    "user": {
      "type": "object",
      "additionalProperties": false,
      "required": ["user_id"],
      "properties": {
        "user_id": { "type": "string" }
      }
    },
    "journey": {
      "type": "object",
      "additionalProperties": false,
      "properties": {
        "journey_id": { "type": "string" },
        "phase_id": { "type": "string" },
        "phase_title": { "type": "string" },
        "day_index": { "type": "integer" },
        "total_days": { "type": "integer" },
        "progress_percent": { "type": "number" },
        "phases": {
          "type": "array",
          "items": {
            "type": "object",
            "additionalProperties": false,
            "required": ["phase_id", "phase_title"],
            "properties": {
              "phase_id": { "type": "string" },
              "phase_title": { "type": "string" }
            }
          }
        },
        "days": {
          "type": "array",
          "items": {
            "type": "object",
            "additionalProperties": false,
            "required": ["day_id", "status"],
            "properties": {
              "day_id": { "type": "string" },
              "status": { "type": "string", "enum": ["active", "completed", "locked"] },
              "sealed_at": { "type": ["string", "null"] }
            }
          }
        }
      }
    },
    "day": {
      "type": "object",
      "additionalProperties": false,
      "required": ["day_id", "status"],
      "properties": {
        "day_id": { "type": "string" },
        "title": { "type": "string" },
        "status": { "type": "string", "enum": ["active", "completed", "locked"] },
        "sealed_at": { "type": ["string", "null"] },
        "practice": {
          "type": "object",
          "additionalProperties": false,
          "required": ["completed"],
          "properties": {
            "completed": { "type": "boolean" }
          }
        },
        "reflection": {
          "type": "object",
          "additionalProperties": false,
          "required": ["prompt", "existing_text"],
          "properties": {
            "prompt": { "type": "string" },
            "existing_text": { "type": "string" },
            "important": { "type": "boolean" }
          }
        }
      }
    },
    "permissions": {
      "type": "object",
      "additionalProperties": false,
      "properties": {
        "can_edit_reflection": { "type": "boolean" },
        "can_complete_practice": { "type": "boolean" },
        "can_seal_day": { "type": "boolean" },
        "can_flag_reflection": { "type": "boolean" }
      }
    },
    "revision": { "type": "integer", "minimum": 0 }
  }
}
