{
  "schema_version": "1.0.0",
  "realm_id": "today",
  "payload_id": "payload-phase-switch-001",
  "generated_at": "2026-07-14T12:05:00Z",
  "user": { "user_id": "user-abc" },
  "journey": {
    "journey_id": "j-001",
    "phase_id": "phase-02",
    "phase_title": "Acceptance",
    "day_index": 1,
    "total_days": 365,
    "progress_percent": 5.2
  },
  "day": {
    "day_id": "day-019",
    "title": "Day 19",
    "status": "active",
    "sealed_at": null,
    "practice": { "completed": false },
    "reflection": {
      "prompt": "What are you ready to accept today?",
      "existing_text": ""
    }
  },
  "permissions": {
    "can_edit_reflection": true,
    "can_complete_practice": true,
    "can_seal_day": false,
    "can_flag_reflection": true
  },
  "revision": 21
}
